{
  "$schema": "https://json-schema.org/draft/2020-12/schema",
  "title": "SessionSnapshotManifest",
  "description": "Immutable, deterministic source-record view resolved for one branch event.\n\nThe manifest contains only Session-scoped source records. Principal and\nProject records remain shared through their existing scopes and are never\ncopied into `visible_records`.",
  "type": "object",
  "properties": {
    "schema": {
      "$ref": "#/$defs/SessionSnapshotManifestSchema"
    },
    "event": {
      "$ref": "#/$defs/BranchSnapshotEvent"
    },
    "sourceStoreRevision": {
      "$ref": "#/$defs/StoreRevision"
    },
    "visibleRecords": {
      "type": "array",
      "items": {
        "$ref": "#/$defs/SnapshotRecordAnchor"
      },
      "uniqueItems": true
    }
  },
  "additionalProperties": false,
  "required": [
    "schema",
    "event",
    "sourceStoreRevision",
    "visibleRecords"
  ],
  "$defs": {
    "SessionSnapshotManifestSchema": {
      "description": "Closed schema identifier for Jiandu's resolved immutable snapshot manifest.",
      "type": "string",
      "enum": [
        "jiandu.dev/session-snapshot-manifest/v1alpha1"
      ]
    },
    "BranchSnapshotEvent": {
      "description": "Strict host intent to branch one committed Session lineage into another.\n\nThis event is not itself proof that `through_message_id` was committed or\nbelongs to the source lineage. That proof remains trusted service state.",
      "type": "object",
      "properties": {
        "schema": {
          "$ref": "#/$defs/BranchSnapshotEventSchema"
        },
        "eventId": {
          "$ref": "#/$defs/EventId"
        },
        "sourceSessionId": {
          "$ref": "#/$defs/SessionId"
        },
        "sourceBranchId": {
          "$ref": "#/$defs/BranchId"
        },
        "throughMessageId": {
          "$ref": "#/$defs/MessageId"
        },
        "targetSessionId": {
          "$ref": "#/$defs/SessionId"
        },
        "targetBranchId": {
          "$ref": "#/$defs/BranchId"
        },
        "mode": {
          "$ref": "#/$defs/BranchSnapshotMode"
        },
        "occurredAt": {
          "$ref": "#/$defs/Timestamp"
        }
      },
      "additionalProperties": false,
      "required": [
        "schema",
        "eventId",
        "sourceSessionId",
        "sourceBranchId",
        "throughMessageId",
        "targetSessionId",
        "targetBranchId",
        "mode",
        "occurredAt"
      ]
    },
    "BranchSnapshotEventSchema": {
      "description": "Closed schema identifier for a host-declared branch snapshot event.",
      "type": "string",
      "enum": [
        "jiandu.dev/branch-snapshot-event/v1alpha1"
      ]
    },
    "EventId": {
      "type": "string",
      "minLength": 5,
      "maxLength": 128,
      "pattern": "^evt_[A-Za-z0-9_-]+$"
    },
    "SessionId": {
      "type": "string",
      "minLength": 5,
      "maxLength": 128,
      "pattern": "^ses_[A-Za-z0-9_-]+$"
    },
    "BranchId": {
      "type": "string",
      "minLength": 4,
      "maxLength": 128,
      "pattern": "^br_[A-Za-z0-9_-]+$"
    },
    "MessageId": {
      "type": "string",
      "minLength": 5,
      "maxLength": 128,
      "pattern": "^msg_[A-Za-z0-9_-]+$"
    },
    "BranchSnapshotMode": {
      "description": "Closed snapshot behavior for the first lineage contract.",
      "type": "string",
      "enum": [
        "snapshot"
      ]
    },
    "Timestamp": {
      "description": "Canonical RFC 3339 timestamp in UTC using the `Z` designator.",
      "type": "string",
      "format": "date-time",
      "minLength": 20,
      "maxLength": 35,
      "pattern": "^\\d{4}-\\d{2}-\\d{2}T\\d{2}:\\d{2}:\\d{2}(?:\\.\\d{0,8}[1-9])?Z$"
    },
    "StoreRevision": {
      "description": "Monotonic revision of the canonical store; zero represents an empty store.",
      "type": "integer",
      "format": "uint64",
      "minimum": 0
    },
    "SnapshotRecordAnchor": {
      "description": "Exact identity of one source Session record visible in a snapshot.\n\nConsumers must load the exact revision and ETag or fail closed; a later\nsource revision is not a substitute for this anchor.",
      "type": "object",
      "properties": {
        "memoryId": {
          "$ref": "#/$defs/MemoryId"
        },
        "revision": {
          "$ref": "#/$defs/Revision"
        },
        "etag": {
          "$ref": "#/$defs/Etag"
        }
      },
      "additionalProperties": false,
      "required": [
        "memoryId",
        "revision",
        "etag"
      ]
    },
    "MemoryId": {
      "type": "string",
      "minLength": 5,
      "maxLength": 128,
      "pattern": "^mem_[A-Za-z0-9_-]+$"
    },
    "Revision": {
      "description": "Positive, monotonically increasing per-record revision.",
      "type": "integer",
      "format": "uint64",
      "minimum": 1
    },
    "Etag": {
      "description": "Opaque entity tag returned by the authoritative store.",
      "type": "string",
      "minLength": 1,
      "maxLength": 256,
      "pattern": "^[!-~]+$"
    }
  }
}
